{
  "schema_version": "c-external-construct-intake-record-0.1.1",
  "record_type": "external_construct_intake_record",
  "record_id": "external-taxonomy-positive-code_reuse",
  "created_at": "2026-08-27T10:10:00+02:00",
  "source_artifact": {
    "author": "Synthetic Taxonomy Fixture",
    "title": "Synthetic construct for relation-specific proof-contract tests",
    "published_at": "2026-08-27T10:00:00+02:00",
    "uri": "fixtures/runtime-integrity/evidence/taxonomy_external_source.json",
    "persistent_id": "urn:synthetic:runtime-integrity:taxonomy-source:0.1",
    "source_hash": "44f9c1e59bed6a24c7b114807775815668d8fba51cde0cc56160b809f936c324",
    "freeze_status": "PUBLIC_REFERENCE_VERIFIED"
  },
  "source_construct": {
    "description": "A synthetic source construct used only to test relation-specific validation without importing external protected code.",
    "source_location": "fixtures/runtime-integrity/evidence/taxonomy_external_source.json"
  },
  "local_target": [
    "tools/validate_runtime_integrity_extension.py#semantic_external_intake"
  ],
  "relation": "CODE_REUSE",
  "relation_proof": {
    "implementation_origin": "REUSED_CODE",
    "mapping_refs": [],
    "adapted_interface_surfaces": [],
    "transformation_evidence_refs": [
      {
        "artifact_id": "taxonomy-transformation:0.1",
        "version": "0.1",
        "hash": "3dd18653c834be0bdb377ea49c9c1f04e6e23f99c58b6694d93631d6e3241a32",
        "uri": "fixtures/runtime-integrity/evidence/taxonomy_transformation.json"
      }
    ],
    "source_code_identities": [
      "synthetic-taxonomy-source:0.1#example_function"
    ],
    "reused_code_boundaries": [
      "tools/validate_runtime_integrity_extension.py#semantic_external_intake"
    ],
    "provenance_evidence_refs": [
      {
        "artifact_id": "taxonomy-provenance:0.1",
        "version": "0.1",
        "hash": "2a8d3ab2b72d01235e61ac60c957cc03a0dbbfe1e00e2ad236da0a4d9359c810",
        "uri": "fixtures/runtime-integrity/evidence/taxonomy_provenance.json"
      }
    ],
    "manual_gate_ref": {
      "artifact_id": "taxonomy-manual-gate:0.1",
      "version": "0.1",
      "hash": "314082421c08d79eec598565179732ecc9513bf059205642822ab583a6eb9930",
      "uri": "fixtures/runtime-integrity/evidence/taxonomy_manual_gate.json"
    }
  },
  "transformation": "The fixture maps a synthetic source into a bounded local validator test without granting ownership, priority, ontology transfer, or live authority.",
  "preserved_properties": [
    "relation-specific proof requirements remain inspectable"
  ],
  "rejected_properties": [
    "automatic ontology transfer"
  ],
  "mapping_failures": [
    "synthetic evidence cannot establish a real external dependency"
  ],
  "terminology_substitutions": [],
  "license_status": "LICENSE_CLEARED_FOR_ADAPTATION",
  "attribution": {
    "required": true,
    "references": [
      "fixtures/runtime-integrity/evidence/taxonomy_external_source.json"
    ]
  },
  "native_antecedents": [
    "native runtime-integrity validator design"
  ],
  "independent_prior_art_refs": [],
  "claim_ceiling_state": "CODE_REUSE_PROOF_BOUND",
  "claim_assertions": {
    "derivation_claimed": false,
    "dependency_claimed": true,
    "priority_claimed": false,
    "ontology_transfer_claimed": false,
    "code_reuse_claimed": true
  },
  "narrative_fields_authoritative": false,
  "claim_ceiling": "This is a synthetic taxonomy fixture only; it establishes no relation to a real external construct and grants no execution authority.",
  "witness_chain_head": "aaaaaaaaaaaaaaaaaaaaaaaaaaaaaaaaaaaaaaaaaaaaaaaaaaaaaaaaaaaaaaaa",
  "license_evidence_refs": [
    {
      "artifact_id": "taxonomy-license-clearance:0.1",
      "version": "0.1",
      "hash": "31d45a92e02cef20d384de98488a980313c0100fa0513501c103b4797a270666",
      "uri": "fixtures/runtime-integrity/evidence/taxonomy_license_clearance.json"
    }
  ]
}
