{
  "schema_version": "c-external-construct-intake-record-0.1.1",
  "record_type": "external_construct_intake_record",
  "record_id": "external-taxonomy-positive-formal_dependency",
  "created_at": "2026-08-27T10:10:00+02:00",
  "source_artifact": {
    "author": "Synthetic Taxonomy Fixture",
    "title": "Synthetic construct for relation-specific proof-contract tests",
    "published_at": "2026-08-27T10:00:00+02:00",
    "uri": "fixtures/runtime-integrity/evidence/taxonomy_external_source.json",
    "persistent_id": "urn:synthetic:runtime-integrity:taxonomy-source:0.1",
    "source_hash": "44f9c1e59bed6a24c7b114807775815668d8fba51cde0cc56160b809f936c324",
    "freeze_status": "PUBLIC_REFERENCE_VERIFIED"
  },
  "source_construct": {
    "description": "A synthetic source construct used only to test relation-specific validation without importing external protected code.",
    "source_location": "fixtures/runtime-integrity/evidence/taxonomy_external_source.json"
  },
  "local_target": [
    "tools/validate_runtime_integrity_extension.py#semantic_external_intake"
  ],
  "relation": "FORMAL_DEPENDENCY",
  "relation_proof": {
    "implementation_origin": "DEPENDENT",
    "mapping_refs": [],
    "adapted_interface_surfaces": [],
    "transformation_evidence_refs": [],
    "source_code_identities": [],
    "reused_code_boundaries": [],
    "provenance_evidence_refs": [],
    "manual_gate_ref": {
      "artifact_id": "taxonomy-manual-gate:0.1",
      "version": "0.1",
      "hash": "314082421c08d79eec598565179732ecc9513bf059205642822ab583a6eb9930",
      "uri": "fixtures/runtime-integrity/evidence/taxonomy_manual_gate.json"
    }
  },
  "transformation": "The fixture maps a synthetic source into a bounded local validator test without granting ownership, priority, ontology transfer, or live authority.",
  "preserved_properties": [
    "relation-specific proof requirements remain inspectable"
  ],
  "rejected_properties": [
    "automatic ontology transfer"
  ],
  "mapping_failures": [
    "synthetic evidence cannot establish a real external dependency"
  ],
  "terminology_substitutions": [],
  "license_status": "REFERENCE_ONLY_NO_CODE_REUSE",
  "attribution": {
    "required": true,
    "references": [
      "fixtures/runtime-integrity/evidence/taxonomy_external_source.json"
    ]
  },
  "native_antecedents": [
    "native runtime-integrity validator design"
  ],
  "independent_prior_art_refs": [],
  "claim_ceiling_state": "FORMAL_DEPENDENCY_PROOF_BOUND",
  "claim_assertions": {
    "derivation_claimed": false,
    "dependency_claimed": true,
    "priority_claimed": false,
    "ontology_transfer_claimed": false,
    "code_reuse_claimed": false
  },
  "narrative_fields_authoritative": false,
  "claim_ceiling": "This is a synthetic taxonomy fixture only; it establishes no relation to a real external construct and grants no execution authority.",
  "witness_chain_head": "aaaaaaaaaaaaaaaaaaaaaaaaaaaaaaaaaaaaaaaaaaaaaaaaaaaaaaaaaaaaaaaa",
  "dependency_evidence_refs": [
    {
      "artifact_id": "taxonomy-dependency-proof:0.1",
      "version": "0.1",
      "hash": "68d758400688906bff310f584cce870766cc703b2bd6611255e48a21f6a1f853",
      "uri": "fixtures/runtime-integrity/evidence/taxonomy_dependency_proof.json"
    }
  ],
  "removal_breaks_evidence_ref": {
    "artifact_id": "taxonomy-removal-breaks:0.1",
    "version": "0.1",
    "hash": "4e6086b6293969fb3b9eb7024aabaec6d8a269aac9c997f94c40f0d41cac1f5a",
    "uri": "fixtures/runtime-integrity/evidence/taxonomy_removal_breaks.json"
  }
}
